{
  "conversions": [
    {
      "use": "implicit",
      "targetType": "Float",
      "meaning": "exact",
      "id": "haxe-int-to-float",
      "exceptionalInputs": [],
      "sourceNullability": "non-null",
      "failureEdgeRequired": false,
      "runtimeFeatures": [],
      "targetNullability": "non-null",
      "hxcIrKind": "numeric-exact",
      "implementation": "direct-c",
      "sourceType": "Int"
    },
    {
      "use": "implicit",
      "targetType": "Float",
      "meaning": "exact",
      "id": "haxe-uint-to-float",
      "exceptionalInputs": [],
      "sourceNullability": "non-null",
      "failureEdgeRequired": false,
      "runtimeFeatures": [],
      "targetNullability": "non-null",
      "hxcIrKind": "numeric-exact",
      "implementation": "direct-c",
      "sourceType": "UInt"
    },
    {
      "use": "implicit",
      "targetType": "UInt",
      "meaning": "modulo-2^32",
      "id": "haxe-int-to-uint-bits",
      "exceptionalInputs": [],
      "sourceNullability": "non-null",
      "failureEdgeRequired": false,
      "runtimeFeatures": [],
      "targetNullability": "non-null",
      "hxcIrKind": "numeric-wrapping",
      "implementation": "direct-c",
      "sourceType": "Int"
    },
    {
      "use": "implicit",
      "targetType": "Int",
      "meaning": "low-32-bits-as-twos-complement",
      "id": "haxe-uint-to-int-bits",
      "exceptionalInputs": [],
      "sourceNullability": "non-null",
      "failureEdgeRequired": false,
      "runtimeFeatures": [],
      "targetNullability": "non-null",
      "hxcIrKind": "numeric-wrapping",
      "implementation": "program-local:hxc.u32.to.i32.bits",
      "sourceType": "UInt"
    },
    {
      "use": "Std.int-or-typed-numeric-cast",
      "targetType": "Int",
      "meaning": "truncate-toward-zero-with-defined-saturation",
      "id": "haxe-std-int",
      "exceptionalInputs": [
        "NaN->0",
        "+infinity->2147483647",
        "-infinity->-2147483648",
        "positive-overflow->2147483647",
        "negative-overflow->-2147483648"
      ],
      "sourceNullability": "non-null",
      "failureEdgeRequired": false,
      "runtimeFeatures": [],
      "targetNullability": "non-null",
      "hxcIrKind": "numeric-saturating",
      "implementation": "program-local:hxc.f64.to.i32.saturating",
      "sourceType": "Float"
    },
    {
      "use": "explicit-binary32-narrow",
      "targetType": "c.Float32",
      "meaning": "round-to-nearest-ties-to-even-binary32",
      "id": "haxe-float-to-c-float32",
      "exceptionalInputs": [
        "NaN->NaN-without-payload-promise",
        "infinity->same-signed-infinity",
        "negative-zero->negative-zero",
        "finite-overflow->same-signed-infinity",
        "finite-underflow->rounded-subnormal-or-same-signed-zero"
      ],
      "sourceNullability": "non-null",
      "failureEdgeRequired": false,
      "runtimeFeatures": [],
      "targetNullability": "non-null",
      "hxcIrKind": "numeric-round-binary32",
      "implementation": "direct-c",
      "sourceType": "Float"
    },
    {
      "use": "explicit-binary64-widen",
      "targetType": "Float",
      "meaning": "exact-binary32-to-binary64",
      "id": "c-float32-to-haxe-float",
      "exceptionalInputs": [
        "NaN->NaN-without-payload-promise",
        "infinity->same-signed-infinity",
        "negative-zero->negative-zero"
      ],
      "sourceNullability": "non-null",
      "failureEdgeRequired": false,
      "runtimeFeatures": [],
      "targetNullability": "non-null",
      "hxcIrKind": "numeric-widen-binary64",
      "implementation": "direct-c",
      "sourceType": "c.Float32"
    },
    {
      "use": "explicit-wrapping",
      "targetType": "c.UInt8",
      "meaning": "modulo-2^8",
      "id": "haxe-int-to-exact-u8",
      "exceptionalInputs": [
        "negative-or-oversized->modulo-2^8"
      ],
      "sourceNullability": "non-null",
      "failureEdgeRequired": false,
      "runtimeFeatures": [],
      "targetNullability": "non-null",
      "hxcIrKind": "numeric-wrapping",
      "implementation": "direct-c",
      "sourceType": "Int"
    },
    {
      "use": "explicit-wrapping",
      "targetType": "Int",
      "meaning": "exact",
      "id": "exact-u8-to-haxe-int",
      "exceptionalInputs": [],
      "sourceNullability": "non-null",
      "failureEdgeRequired": false,
      "runtimeFeatures": [],
      "targetNullability": "non-null",
      "hxcIrKind": "numeric-exact",
      "implementation": "direct-c",
      "sourceType": "c.UInt8"
    },
    {
      "use": "explicit-wrapping",
      "targetType": "c.Int32",
      "meaning": "exact",
      "id": "exact-signed-widen",
      "exceptionalInputs": [],
      "sourceNullability": "non-null",
      "failureEdgeRequired": false,
      "runtimeFeatures": [],
      "targetNullability": "non-null",
      "hxcIrKind": "numeric-exact",
      "implementation": "direct-c",
      "sourceType": "c.Int8"
    },
    {
      "use": "explicit-wrapping",
      "targetType": "c.Int16",
      "meaning": "exact",
      "id": "exact-unsigned-to-signed-widen",
      "exceptionalInputs": [],
      "sourceNullability": "non-null",
      "failureEdgeRequired": false,
      "runtimeFeatures": [],
      "targetNullability": "non-null",
      "hxcIrKind": "numeric-exact",
      "implementation": "direct-c",
      "sourceType": "c.UInt8"
    },
    {
      "use": "explicit-wrapping",
      "targetType": "c.Int8",
      "meaning": "low-8-bits-as-twos-complement",
      "id": "exact-signed-narrow-wrapping",
      "exceptionalInputs": [],
      "sourceNullability": "non-null",
      "failureEdgeRequired": false,
      "runtimeFeatures": [],
      "targetNullability": "non-null",
      "hxcIrKind": "numeric-wrapping",
      "implementation": "program-local:hxc.integer.to.i8.wrapping",
      "sourceType": "c.Int32"
    },
    {
      "use": "explicit-wrapping",
      "targetType": "c.UInt8",
      "meaning": "modulo-2^8",
      "id": "exact-unsigned-narrow-wrapping",
      "exceptionalInputs": [],
      "sourceNullability": "non-null",
      "failureEdgeRequired": false,
      "runtimeFeatures": [],
      "targetNullability": "non-null",
      "hxcIrKind": "numeric-wrapping",
      "implementation": "direct-c",
      "sourceType": "c.UInt32"
    },
    {
      "use": "explicit-wrapping",
      "targetType": "c.Int32",
      "meaning": "low-32-bits-as-twos-complement",
      "id": "exact-unsigned-to-signed-bits",
      "exceptionalInputs": [],
      "sourceNullability": "non-null",
      "failureEdgeRequired": false,
      "runtimeFeatures": [],
      "targetNullability": "non-null",
      "hxcIrKind": "numeric-wrapping",
      "implementation": "program-local:hxc.integer.to.i32.wrapping",
      "sourceType": "c.UInt32"
    },
    {
      "use": "explicit-checked",
      "targetType": "c.Int8",
      "meaning": "range-check-then-exact",
      "id": "exact-checked-narrow",
      "exceptionalInputs": [
        "out-of-range->failure-edge"
      ],
      "sourceNullability": "non-null",
      "failureEdgeRequired": true,
      "runtimeFeatures": [],
      "targetNullability": "non-null",
      "hxcIrKind": "numeric-checked",
      "implementation": "program-local:hxc.primitive.to.c.Int8.checked",
      "sourceType": "c.Int32"
    },
    {
      "use": "nullable-inject",
      "targetType": "Int",
      "meaning": "construct-present-nullable",
      "id": "nullable-scalar-inject",
      "exceptionalInputs": [],
      "sourceNullability": "non-null",
      "failureEdgeRequired": false,
      "runtimeFeatures": [],
      "targetNullability": "nullable",
      "hxcIrKind": "nullable-inject",
      "implementation": "direct-c",
      "sourceType": "Int"
    },
    {
      "use": "nullable-unwrap",
      "targetType": "Int",
      "meaning": "check-present-then-extract",
      "id": "nullable-scalar-unwrap",
      "exceptionalInputs": [
        "absent->failure-edge"
      ],
      "sourceNullability": "nullable",
      "failureEdgeRequired": true,
      "runtimeFeatures": [],
      "targetNullability": "non-null",
      "hxcIrKind": "nullable-unwrap",
      "implementation": "direct-c",
      "sourceType": "Int"
    }
  ],
  "requirements": [
    "HXC-SEM-001",
    "HXC-SEM-002",
    "HXC-SEM-003",
    "HXC-SEM-005",
    "HXC-FFI-005"
  ],
  "profiles": [
    "portable",
    "metal"
  ],
  "floatContract": {
    "comparisons": "ordered C comparisons; NaN is unordered and unequal to itself; infinities retain IEEE ordering",
    "cType": "double",
    "fastMath": "forbidden for Haxe semantic lowering because it can erase NaN, infinity, and signed-zero behavior",
    "negativeZero": "preserved by storage and floating operations; compares equal to positive zero",
    "format": "IEC 60559 / IEEE 754 binary64 required by the resolved target tuple",
    "stdIntExceptionalPolicy": [
      "finite in-range values truncate toward zero",
      "negative zero converts to 0",
      "NaN converts to 0",
      "positive infinity and finite positive overflow convert to 2147483647",
      "negative infinity and finite negative overflow convert to -2147483648"
    ]
  },
  "nullability": [
    {
      "representation": "tagged optional { bool has_value; T value; }",
      "sourcePattern": "Null<non-null scalar>",
      "profiles": [
        "portable",
        "metal"
      ],
      "runtimeFeatures": [],
      "invariant": "value is read only when has_value is true; a proven non-null value may erase the wrapper"
    },
    {
      "representation": "nullable pointer to target-owned T representation",
      "sourcePattern": "Null<reference-like T>",
      "profiles": [
        "portable",
        "metal"
      ],
      "runtimeFeatures": [],
      "invariant": "null is the null pointer; non-null unwrap requires an explicit checked edge"
    },
    {
      "representation": "C pointer with explicit nullable native contract",
      "sourcePattern": "c.NullablePtr<T>",
      "profiles": [
        "portable",